{"contract_id":"pm-destructive-command-contract/1.0.0","prepare_expiry_seconds":600,"commands":[{"command_id":"523e4567-e89b-42d3-a456-426614174004","command_type":"format_storage_prepare","not_before":"2026-08-13T20:02:00Z","expires_at":"2026-08-13T20:12:00Z","attempt":1,"idempotency_key":"format:prepare:1","required_firmware_capability":"destructive_commands_v1","payload":{"confirmation_token":"00112233445566778899aabbccddeeff"}},{"command_id":"623e4567-e89b-42d3-a456-426614174005","command_type":"format_storage_commit","not_before":"2026-08-13T20:03:00Z","expires_at":"2026-08-13T20:12:00Z","attempt":1,"idempotency_key":"format:commit:1","required_firmware_capability":"destructive_commands_v1","payload":{"prepare_command_id":"523e4567-e89b-42d3-a456-426614174004","confirmation_token":"00112233445566778899aabbccddeeff"}},{"command_id":"723e4567-e89b-42d3-a456-426614174006","command_type":"data_reset_prepare","not_before":"2026-08-13T20:04:00Z","expires_at":"2026-08-13T20:14:00Z","attempt":1,"idempotency_key":"reset:prepare:1","required_firmware_capability":"destructive_commands_v1","payload":{"confirmation_token":"102132435465768798a9bacbdcedfe0f","reset_generation":4,"server_sequence_floor":42}},{"command_id":"823e4567-e89b-42d3-a456-426614174007","command_type":"data_reset_commit","not_before":"2026-08-13T20:05:00Z","expires_at":"2026-08-13T20:14:00Z","attempt":1,"idempotency_key":"reset:commit:1","required_firmware_capability":"destructive_commands_v1","payload":{"prepare_command_id":"723e4567-e89b-42d3-a456-426614174006","confirmation_token":"102132435465768798a9bacbdcedfe0f","reset_generation":4,"sequence_floor":47}},{"command_id":"923e4567-e89b-42d3-a456-426614174008","command_type":"data_reset_cancel","not_before":"2026-08-13T20:06:00Z","expires_at":"2026-08-13T20:14:00Z","attempt":1,"idempotency_key":"reset:cancel:1","required_firmware_capability":"destructive_commands_v1","payload":{"prepare_command_id":"723e4567-e89b-42d3-a456-426614174006"}}],"results":[{"command_id":"523e4567-e89b-42d3-a456-426614174004","state":"succeeded","progress_percent":100,"result_code":"ok","evidence":{"prepare_command_id":"523e4567-e89b-42d3-a456-426614174004","acknowledged_records_lost":42,"unacknowledged_records_lost":5,"ready":true}},{"command_id":"623e4567-e89b-42d3-a456-426614174005","state":"succeeded","progress_percent":100,"result_code":"ok","evidence":{"prepare_command_id":"523e4567-e89b-42d3-a456-426614174004","acknowledged_records_lost":42,"unacknowledged_records_lost":5,"formatted":true}},{"command_id":"723e4567-e89b-42d3-a456-426614174006","state":"succeeded","progress_percent":100,"result_code":"ok","evidence":{"prepare_command_id":"723e4567-e89b-42d3-a456-426614174006","reset_generation":4,"server_sequence_floor":42,"sequence_floor":47,"ready":true}},{"command_id":"823e4567-e89b-42d3-a456-426614174007","state":"succeeded","progress_percent":100,"result_code":"ok","evidence":{"prepare_command_id":"723e4567-e89b-42d3-a456-426614174006","reset_generation":4,"sequence_floor":47}},{"command_id":"923e4567-e89b-42d3-a456-426614174008","state":"succeeded","progress_percent":100,"result_code":"ok","evidence":{"prepare_command_id":"723e4567-e89b-42d3-a456-426614174006","cancelled":true}},{"command_id":"a23e4567-e89b-42d3-a456-426614174009","state":"failed","progress_percent":1,"result_code":"ESP_ERR_TIMEOUT","evidence":{"prepare_command_id":"723e4567-e89b-42d3-a456-426614174006","ready":false,"reason":"expired"}}]}
